source,sample,construction,Y word,X  word,conn.,Y anim,WO - X first
fet.ouc.ru,"Всё вместе было чувства торжество, Но то < была не жизнь, а волшебство >. 22 И, сам не свой, я, наклоняясь, чуть ","не жизнь, а волшебство",жизнь,волшебство,pos,no,no
chisprud.ru,"Один ряд с именами известнейших чтоб жизнь < была не жизнь, а загляденье >, И чтобы всегда укрыться. Графические ","не жизнь, а загляденье",жизнь,загляденье,pos,no,no
irkbo.ru,"счастья и всего самого везло, Чтоб жизнь < была не жизнь, а загляденье >, И чтобы каждый. Садятся заи свадьбе ","не жизнь, а загляденье",жизнь,загляденье,pos,no,no
lucky-day.ru,"Хотим, чтобы тебе всегда везло, Чтоб жизнь < была не жизнь, а загляденье >, И чтобы каждый день был днем рожденья! ","не жизнь, а загляденье",жизнь,загляденье,pos,no,no
song-rap.ru,"грядущем оновом году всегда везло, Чтоб жизнь < была не жизнь, а загляденье >. Всегда, Пусть будет душа, как сейчас ","не жизнь, а загляденье",жизнь,загляденье,pos,no,no
irkbo.ru,"Узнала б никогда достигли в жизни жизнь < была не жизнь, а загляденье >, И чтобы каждый день был днем рожденья. ","не жизнь, а загляденье",жизнь,загляденье,pos,no,no
vtusovke.ru,"ъсНовый год прольется йшдождь пусть золотой,ж < была не жизнь, а загляденье >, И чтобы каждый день был днем рожденья. ","не жизнь, а загляденье",жизнь,загляденье,pos,no,no
orenkluch.ru,"поздравления тете на день рождение, Чтоб жизнь < была не жизнь, а загляденье >, И чтобы. Которая останется дань  ","не жизнь, а загляденье",жизнь,загляденье,pos,no,no
vtusovke.ru,"искру счастья и радости, и пусть чтоб жизнь < была не жизнь, а загляденье >, И чтобы каждый день. Без оглядки ","не жизнь, а загляденье",жизнь,загляденье,pos,no,no
eurotitan.ru,"профессионального дня. Везло, Чтоб жизнь < была не жизнь, а загляденье > любойв, Ветра выпьемто же за то, чтобыщ ","не жизнь, а загляденье",жизнь,загляденье,pos,no,no
fil-grand.ru,"будущее. Эти транспаранты можно сделать как < была не жизнь, а загляденье >, И чтобы каждый день. Видов криминалистических ","не жизнь, а загляденье",жизнь,загляденье,pos,no,no
city-rock.ru,"йзаботливыми. Транспаранты можно сделать как < была не жизнь, а загляденье >, И чтобы каждый предназначен света при  ","не жизнь, а загляденье",жизнь,загляденье,pos,no,no
news76week.ru,"сегодня. Никогда не встречает грусть она тебя < была не жизнь, а загляденье >, И чтобы каждый день был. Нет ни  ","не жизнь, а загляденье",жизнь,загляденье,pos,no,no
news76week.ru," границы Потому всегда везло, Чтоб жизнь < была не жизнь, а загляденье >, И чтобы каждый день был. Пожелаем ","не жизнь, а загляденье",жизнь,загляденье,pos,no,no
irkbo.ru,"появляйтесь если таких юочень везло, Чтоб жизнь < была не жизнь, а загляденье >, И чтобы каждый день был днем рожденья. ","не жизнь, а загляденье",жизнь,загляденье,pos,no,no
vtusovke.ru," с днём рождения для виктора, Чтоб жизнь < была не жизнь, а загляденье >, И чтобы каждый. Урок 5. Внутреннее ","не жизнь, а загляденье",жизнь,загляденье,pos,no,no
vtusovke.ru,"примроды, И мы сегодняоы везло, Чтоб жизнь < была не жизнь, а загляденье >, И чтобы каждый день был днем рожденья. ","не жизнь, а загляденье",жизнь,загляденье,pos,no,no
fil-grand.ru," жизни в рамках всей страны. Жизнь < была не жизнь, а загляденье >, И чтобы каждый скоро пропадут, ты сядешь ","не жизнь, а загляденье",жизнь,загляденье,pos,no,no
irkbo.ru,"привела за руку, Пусть принесут чтоб жизнь < была не жизнь, а загляденье >, И чтобы каждый день был. Случайная ","не жизнь, а загляденье",жизнь,загляденье,pos,no,no
b177.ru,"видшеть здесь замечиательную пардпу жизнь < была не жизнь, а загляденье >, И чтобы каждый день был днем рожденья. ","не жизнь, а загляденье",жизнь,загляденье,pos,no,no
240x320.ru,"душевное поздравление в прозе с днём рождения < была не жизнь, а загляденье > сечейчас устроим Из подарков хицдт-парад ","не жизнь, а загляденье",жизнь,загляденье,pos,no,no
mobilcentre.ru," очень оригинально и вполне. Жизнь < была не жизнь, а загляденье >, И чтобы каждый ты вспомнишъвь, что быть ","не жизнь, а загляденье",жизнь,загляденье,pos,no,no
b177.ru,"должлна день чтобы ... Везло, Чтоб жизнь < была не жизнь, а загляденье > честной, сменой будь краше, Поскольку ты ","не жизнь, а загляденье",жизнь,загляденье,pos,no,no
findtour.ru,"восток дело тонкое.... оценка это < был не отдых, а сказка >!!!!!!! побывали до этого во многих отелях ","не отдых, а сказка",отдых,сказка,pos,no,no
knigosite.ru,"оригинал"", ""копирует"". Как бы то ни было, это < была не работа, а мечта >. Единственная задача – проехать из пункта ","не работа, а мечта",работа,мечта,pos,no,no
missoffice.ru,"раскрепощено в подобной обстановке. Это < была не работа, а наслаждение >. И еще один чудесный день в моей жизни.","не работа, а наслаждение",работа,наслаждение,pos,no,no
htt.mosbiblio.ru," в банде, во главе которой – Ричард. Это < была не работа, а наслаждение >». Дымок марихуаны приятно разнообразил  ","не работа, а наслаждение",работа,наслаждение,pos,no,no
studentur.ru,"Италии, Франции и Германии. По началу это < была не работа, а отдых > =)) Постепенно я включалась в проведение ","не работа, а отдых",работа,отдых,pos,no,no
kuzkr.ru,"горное дело, эстетику, литературу. И это < была не работа, а песня >... В любой школе отношения между людьми ","не работа, а песня",работа,песня,pos,no,no
svgbdvr.ru,"интуитивном уровне. Для него сама поездка в Москву < была не работой, а праздником >: знаменитых людей вживую увидит и столичными ","не работа, а праздник",работа,праздник,pos,no,no
eressea.ru,"вообще никак. Он все ворчал, что раньше < была не работа, а развлечение >, но с тех пор как примерно год назад вся ","не работа, а развлечение",работа,развлечение,pos,no,no
spravka08.ru," словам Сытина, со стороны писателя «это < была не работа, а священнослужение >. Толстой принимал самое близкое участие ","не работа, а священнослужение",работа,священнослужение,pos,no,no
forum.acework.ru,"Нью-Йорке. В перуанском ресторане. Для меня это < было не работа, а сказка >. Просто выстроил отличные отношения с хозяевами ","не работа, а сказка",работа,сказка,pos,no,no
stavropol.findjob.ru,"Пару лет в Juno я был вполне счастлив. Это < была не работа, а сказка >. (У меня даже брали интервью для сайта, ","не работа, а сказка",работа,сказка,pos,no,no
slabunova.ru,"изменило наше представление о шоппинге. Это < была не работа, а удовольствие >, отдых и даже развлечение. Супругу одели ","не работа, а удовольствие",работа,удовольствие,pos,no,no
molodmos.ru,"требовал детальной проработки. Для меня это < была не работа, а удовольствие >. Поскольку я никуда не торопился, это заняло ","не работа, а удовольствие",работа,удовольствие,pos,no,no
tverlib.ru,"работать? Будет ли продолжение? - Это < была не работа, а удовольствие >. Я заново перечитал Стругацких, окунулся ","не работа, а удовольствие",работа,удовольствие,pos,no,no
lotusale.ru,"хорошую посуду. Для того, что бы готовка < была не работой, а удовольствием > посуда должна быть не только качественной ","не работа, а удовольствие",работа,удовольствие,pos,no,no
my-madonna.ru,"уверенность, что все будет хорошо. Словно Ангелина < была не женщиной, а ангелом > - его персональным ангелом-хранителем. ","не женщина, а ангел",женщина,ангел,pos,yes,no
lib.ru,"соответствовала духу нашей индустриальной эпохи. Это < была не женщина, а машина >. Из тех женщин, которые кричат: ""Долой  ","не женщина, а машина",женщина,машина,pos,yes,no
31ok87pomnim.ru,"все это только иногда. А в основном это < была не женщина, а машина >: когда угодно, сколько угодно и как угодно","не женщина, а машина",женщина,машина,pos,yes,no
forlit.ru,", бокс, нравилось копаться в байках, это < была не женщина, а сказка >. Слишком хороша во всём, чтобы быть похожей ","не женщина, а сказка",женщина,сказка,pos,yes,no
sex-history.ru,"тела, охваченные безудержным порывом. Это < была не женщина, а сказка >. Такую трудно было удовлетворить за один ","не женщина, а сказка",женщина,сказка,pos,yes,no
news-nomad.ru,"успехами в школе и в университете, короче, < был не ребенок, а золото >! И только его младший брат-хулиган знал ","не ребенок, а золото",ребенок,золото,pos,yes,no
usde.ru,"успехами в школе и в университете, короче, < был не ребенок, а золото >! И только его младший брат-хулиган знал ","не ребенок, а золото",ребенок,золото,pos,yes,no
pravmir.ru,"бабушку, а Дуську — не буду!» Дуся < была не ребенок, а подарок >, и я решила, что это результат нового метода ","не ребенок, а подарок",ребенок,подарок,pos,yes,no
detectiverol.mybb.ru,"латинского. Мама восхищалась свое малышкой, это < был не ребенок, а чудо > как говорила она. Лишь одно волновала родителей ","не ребенок, а чудо",ребенок,чудо,pos,yes,no
zemgym.ru,"заботилась, а о других людях. Как будто эт < был не человек, а ангел >, у которого задача - помогать людям. Она ","не человек, а ангел",человек,ангел,pos,yes,no
pravoslavie.ru,"человек, что за человек…» И это действительно < был не человек, а ангел >! Батюшка изнемогал после операции ","не человек, а ангел",человек,ангел,pos,yes,no
toldot.ru,"(это происходило только в Йом Кипур), он < был не человеком, а ангелом >, как сказано в книге Ваикра Раба . Поэтому ","не человек, а ангел",человек,ангел,pos,yes,no
orthedu.ru,"сорокадневного путешествия. Подлинно, это < был не человек, а ангел > во плоти. Так же Писание указывает ","не человек, а ангел во плоти",человек,ангел во плоти,pos,yes,no
situation.ru,"остряки-памфлетисты заявляли даже в шутку, что он < был не человек, а бог-солнце >. Сверхъестественная сила этого мифа не  ","не человек, а бог-солнце",человек,бог-солнце,pos,yes,no
imperium.lenin.ru,"который приснился впервые еще весной, Мадими < была не человеком, а деревом > -- могучим, сильным деревом, пустившим  ","не человек, а дерево",человек,дерево,pos,yes,no
historic.ru,"Ислямов скончался. Это большая утрата. Он < был не человек, а лев >, бесстрашный герой Родины, комсомолец. ","не человек, а лев",человек,лев,pos,yes,no
speleo-perm.ru,"Суббота Первый гость, пришедший рано, вовсе < был не человек, а луч > солнца на палатке, проникающий в глаза… ","не человек, а луч солнца на палатке, проникающий в глаза",человек,"луч солнца на палатке, проникающий в глаза",pos,yes,no
magazines.russ.ru,"лицам. Сейчас он умер, к сожалению. Но это < был не человек, а фейерверк >. Он ехал в метро на эскалаторе, вдруг поднимал ","не человек, а фейерверк",человек,фейерверк,pos,yes,no
strasti.ru,"способами, о которых я даже думать не могла. Это < была не жизнь, а ад > и до сих пор я это вспоминаю с содроганием ","не жизнь, а ад",жизнь,ад,neg,no,no
parabol.ru,"поженились. Через пару месяцев разошлись. Это < была не жизнь, а ад >. Еще через месяц я получил письмо от Марии ","не жизнь, а ад",жизнь,ад,neg,no,no
npacific.ru,"декабрь 1977 года, вспоминает: ""Зимой там < была не жизнь, а борьба > за существование. Утром встаешь, топишь ","не жизнь, а борьба за существование",жизнь,борьба за существование,neg,no,no
sob.yamalmed.ru,"всякие гадости, психопат. Я хочу сказать, это < была не жизнь, а вереница > фильмов ужасов. Как выбрать эллиптический ","не жизнь, а вереница фильмов ужасов",жизнь,вереница фильмов ужасов,neg,no,no
kazved.ru,"правоту экстрасенса признала. До 40 лет у нее < была не жизнь, а выживание >: раннее сиротство, несколько мачех, отец ","не жизнь, а выживание",жизнь,выживание,neg,no,no
pressaobninsk.ru,"до этого семья жила в гостинице ЦИПК. Это < была не жизнь, а выживание >. Там даже готовить не разрешали. ","не жизнь, а выживание",жизнь,выживание,neg,no,no
tourout.ru," & Residence Хуже я еще не отдыхала. Это < был не отдых, а борьба > за выживание. Питание отвратительное, свободных ","не отдых, а борьба за выживание",отдых,борьба за выживание,neg,no,no
angely-tour.ru,"зайдет. И вообще скукотища страшная, у меня < был не отдых, а борьба > за лежаки и еду. Удачного отдыха. ","не отдых, а борьба за лежаки и еду",отдых,борьба за лежаки и еду,neg,no,no
iduvsud.ru,"включает в себя минимум прожиточный... Это < был не отдых, а выживание >. Хотим вернуть потраченные деньги + стоимость ","не отдых, а выживание",отдых,выживание,neg,no,no
kinokosmos.ru,"количеству людей! 17.10.10 21:00(3 зал)Это < был не отдых, а испытание >. ДЫШАТЬ НЕЧЕМ БЫЛО ВОООБЩЕ! По ошушениям ","не отдых, а испытание",отдых,испытание,neg,no,no
tury.ru,"оставляют желать лучшего. Политика... Это < был не отдых, а кошмар >, который не прекращался в течении 7 дней ","не отдых, а кошмар",отдых,кошмар,neg,no,no
turexo.ru,"закрывается на хилинький ключик. Вообщем, это < был не отдых, а КОШМАР >!!!!! Да, еще цена на билеты высоченная, ","не отдых, а КОШМАР",отдых,КОШМАР,neg,no,no
story.travel.mail.ru,"Только из-за этого и согласились. Вообще это < был не отдых, а кошмар >. Кроме нас ещё были две мои подруги с детьми ","не отдых, а кошмар",отдых,кошмар,neg,no,no
ladymama.ru,"и в полтора года пытались отдохнуть, это < был не отдых, а кошмар > какой-то. Elenоchka 32 , если речь ","не отдых, а кошмар какой-то",отдых,кошмар какой-то,neg,no,no
tovar2.ru,"три дня на берег озера отдыхать, так это < был не отдых, а мучение >. Купили в аптеке мазь от комаров, но было ","не отдых, а мучение",отдых,мучение,neg,no,no
turexo.ru,"гостиницу для тихого семейного отдыха! Это < был не отдых, а мучение >. Многие из нас понимают не по наслышке ","не отдых, а мучение",отдых,мучение,neg,no,no
ayda.ru,"сравнить !я не в первый раз в египте! это < был не отдых , а мучение > !номер - просто кошмар !!! пока на третий ","не отдых, а мучение",отдых,мучение,neg,no,no
turkei.ru," так что для нас, как и для ребенка, это < был не отдых, а мучение >. Ребенок, естественно, под эту не прекращавшуюся ","не отдых, а мучение",отдых,мучение,neg,no,no
5h.ru,"драги.. фууууу мерзкое зрелище!!! Это < был не отдых, а мучения >! И если вам будут рассказывать, какая это ","не отдых, а мучения",отдых,мучения,neg,no,no
lovevirt1.ru,"они отдадут последнюю рубаху и пры...Это < был не отдых, а пытка >...На счастье, такое со мной было тока один ","не отдых, а пытка",отдых,пытка,neg,no,no
infotur.ru,"!!!!!! Отдыхали с 5.12.10 по 14.12.10!!!! Это < был не отдых, а стресс >!!!!!! Началось все с расселения, а закончилось ","не отдых, а стресс",отдых,стресс,neg,no,no
knigosite.ru," в рабочем состоянии!» – он отдыхал? Это < был не отдых, а угар >, прожигание жизни, уничтожение здоровья ","не отдых, а угар, прожигание жизни, уничтожение здоровья ",отдых,"угар, прожигание жизни, уничтожение здоровья ",neg,no,no
otpusku.ru,"жареная и соленая обязательно с сыром. Это < был не отдых, а ужас >. Правда, отдых был недорогим, но сервис ","не отдых, а ужас",отдых,ужас,neg,no,no
otpusku.ru,"жареная и соленая обязательно с сыром. Это < был не отдых, а ужас >. Правда, отдых был недорогим, но сервис ","не отдых, а ужас",отдых,ужас,neg,no,no
kaz-volnoe.narod.ru,"стал моим врагом за всё это. В общем, это < была не работа, а каторга >. И директор знал об этом – я показывал  ","не работа, а каторга",работа,каторга,neg,no,no
pics.zaloba.ru,"работать, но их темпы меня не устраивали. Это < была не работа, а муки > адские, мне пришлось все бросить и за свои ","не работа, а муки адские",работа,муки адские,neg,no,no
business-gazeta.ru," в отношении дилер-дистрибьютор. С Volvo < была не работа, а мучение >. Но это решение нам все равно далось тяжело ","не работа, а мучение",работа,мучение,neg,no,no
likebook.ru,"Взрывоопасное. Убийственное. Это ведь < была не женщина, а боеголовка >, для которой существует только один критический ","не женщина, а боеголовка",женщина,боеголовка,neg,yes,no
prosv.ru,"она испугалась, попросила пощады, но это < была не женщина, а дьявол >. — В последний раз спрашиваю тебя ","не женщина, а дьявол",женщина,дьявол,neg,yes,no
