source,sample,construction,Y word,X  word,conn.,Y anim,WO - X first
briefly.ru,"углы, Косме продолжает настаивать, что это < была не женщина, а дьявол > в виде женщины, ибо в этом нет ничего удивительного ","не женщина, а дьявол в виде женщины",женщина,дьявол в виде женщины,neg,yes,no
svetdomspb.ru,"косметического средства. Конечно, это < был не ребенок, а бандит >. Но на этот раз решил пересилить себя.  ","не ребенок, а бандит",ребенок,бандит,neg,yes,no
vashaktiv.ru,"ними был монах, которого они слушали, и это < был не человек, а беда >. Он сказал им: «У Христа, да будет мир  ","не человек, а беда",человек,беда,neg,yes,no
zaistinu.ru,"а за ней человек в белом костюме. Но это < был не человек, а бес >. А то, что чадо славимого старца, так этот ","не человек, а бес",человек,бес,neg,yes,no
kurehin.ru,"с версией о том, что Ленин на самом деле < был не человеком, а грибом >. (*26) Адорно – создатель собственной ","не человек, а гриб",человек,гриб,neg,yes,no
liblarge.ru,", не издав ни звука, будто действительно < был не человеком, а демоном >, родившимся во тьме этого города, упал  ","не человек, а демон",человек,демон,neg,yes,no
deathnote.ru,"просто чудовищную силу, словно перед ним < был не человек, а демон >. А притяжение к полу вдруг стало невыносимо ","не человек, а демон",человек,демон,neg,yes,no
thelib.ru," дороге. Некоторые утверждали, что Цемах < был не человек, а демон >. Акшу похоронили возле могилы известного ","не человек, а демон",человек,демон,neg,yes,no
operaghost.ru," что у Кристины перехватило дыхание. Это < был не человек, а дьявол >, способный погубить ее и разрушить все  ","не человек, а дьявол",человек,дьявол,neg,yes,no
allk.ru,"рыцари в ответ проклинали его, твердя, что он < был не человек, а дьявол >. – Ведь он убил здесь у нас двенадцать  ","не человек, а дьявол",человек,дьявол,neg,yes,no
pisemskiy.org.ru,"наборах касательно интереса он действительно < был не человек, а дьявол >. Один из голов тоже представлял при этом ","не человек, а дьявол",человек,дьявол,neg,yes,no
romanbook.ru,"Слишком долго, – проворчала бабушка. – Она < была не человек, а дьявол >. Пока Роберт пропадал на работе, Элинор ","не человек, а дьявол",человек,дьявол,neg,yes,no
gayboom.ru," становились зверскими по своей сути - я < был не человеком, а животным >, утоляющим свой инстинкт. Но то, что подо ","не человек, а животное",человек,животное,neg,yes,no
ko-punch.ru,"браке до конца дней своих. Это раньше Тайсон < был не человеком, а животным >. Теперь же он вполне нормальный цивилизованный ","не человек, а животное",человек,животное,neg,yes,no
simvol-veri.ru,"позволения предать мертвые тела земле. Судья < был не человек, а зверь >, или что-то жесточе самого зверя: он не ","не человек, а зверь",человек,зверь,neg,yes,no
gui-de-mare.ru,"полладони. – Наверное, этот Ортега < был не человеком, а зверем >… – Похуже зверя, — нахмурился рассказчик ","не человек, а зверь",человек,зверь,neg,yes,no
reshma.nov.ru,"кровью арестантов и усеяна их костями. Это < был не человек, а зверь >, и еще какой зверь! Кора - это место одних ","не человек, а зверь",человек,зверь,neg,yes,no
dumaalex.org.ru,"думая, не помогут ли новые просьбы. Но это < был не человек, а камень >. Я подошел к нему: ""Ладно, - сказал я вполголоса ","не человек, а камень",человек,камень,neg,yes,no
kupibri.ru,"любовнике, рухнувшем к ее ногам. Это < был не человек, а катастрофа >. Всегда спрашивал, прежде чем что-либо  ","не человек, а катастрофа",человек,катастрофа,neg,yes,no
fanbio.ru,"вымогать... Умел, умел старый греховодник! Это < был не человек, а кремень >. Да, он был холоден и тверд, как кремень ","не человек, а кремень",человек,кремень,neg,yes,no
lib.ru,"вымогать... Умел, умел старый греховодник! Это < был не человек, а кремень >. Да, он был холоден и тверд, как кремень ","не человек, а кремень",человек,кремень,neg,yes,no
tolstoy-a-n.lit-info.ru,"полу, огромный рот лязгал зубами, точно это < был не человек, а крокодил >, глаза горели, как два красные фонаря,  ","не человек, а крокодил",человек,крокодил,neg,yes,no
emremark.ru,"Она разговаривала с Гольдбахом, словно то < был не человек, а кусок > дерева, без всяких эмоций, ужасающе равнодушно ","не человек, а кусок дерева",человек,кусок дерева,neg,yes,no
nash-sovremennik.ru,"смертна, и сражай себе подобных! То < был не человек, а наважденье >. Пусть целый ад поднимется навстречу ","не человек, а наважденье",человек,наважденье,neg,yes,no
medkrug.ru,"испытала все кошмары депрессии. На тот момент я < была не человеком, а овощем >. Благодарна своим родителям, которые пытались ","не человек, а овощ",человек,овощ,neg,yes,no
jorigami.narod.ru,"Чобота всё равно никакой жизни не было. Чобот < был не человек, а раб >. Барина у него отняли, так он Наташку выдумал ","не человек, а раб",человек,раб,neg,yes,no
romanov-murman.narod.ru,"дожил до старческого возраста, но это уже < был не человек, а руина >. Они все гов орили, что на отчитку, во  ","не человек, а руина",человек,руина,neg,yes,no
lenta2012.ru," которым еще надо доказывать, что сталин < был не человеком, а сатаной >, говорить и спорить нечего. Это либо дебилы ","не человек, а сатана",человек,сатана,neg,yes,no
statehistory.ru,"содержался злополучный пленник... Перед ним < был не человек, а скелет >. Тяжелые окопы висели на руках и на ногах ","не человек, а скелет",человек,скелет,neg,yes,no
castalia.ru,"удовольствий, довольно показывают, что он < был не человек, а скот >. Успокоившись немного, принялся объяснять ","не человек, а скот",человек,скот,neg,yes,no
bbs.055555.pp.ru,"вскочил и опасливо поглядел на меня, точно я < был не человеком, а снарядом >, который невзначай залетел в блиндаж и  ","не человек, а снаряд",человек,снаряд,neg,yes,no
www2.newsanons.ru,"бывшие лучшие друзья будут говорить, что это < был не человек, а тиран > и т.д. Наверное, это природное в человеке ","не человек, а тиран",человек,тиран,neg,yes,no
orlovhorse.ru,"принадлежавшее Люку пахло рыбой, точно он < был не человек, а тюлень >. Но мы, конечно, и виду не подали. Мы были ","не человек, а тюлень",человек,тюлень,neg,yes,no
versia.childfest.ru,"пошел в переход, что надо сделать чтобы он < был не человеком, а убожеством >? Кто-нибудь видел руки этих людей, а глаза ","не человек, а убожество",человек,убожество,neg,yes,no
ikar-slav.ru,"поблагодарив за работу, не расплатившись, то это < был не человек, а черт >. Истории о невозможности подковать лошадь ","не человек, а черт",человек,черт,neg,yes,no
autocrane-arenda.ru,"просьбу, дорогая. Поистине Гормен Хэррисон < был не человек, а чудовище >. Оставив жену умирать в одиночестве, Бог ","не человек, а чудовище",человек,чудовище,neg,yes,no
hipersona.ru,"похожего на того, о ком говорилось: « Кан Шэн < был не человек, а чудовище >». Его биография вкратце такова. ","не человек, а чудовище",человек,чудовище,neg,yes,no
2lib.ru,"нелепо облекал его туловище, словно Вельзевул < был не человек, а чучело >, на которое забавы ради напялили одежду ","не человек, а чучело",человек,чучело,neg,yes,no
thelib.ru,"Он нашел выгодную работу. Собственно, это < была не работа, а игра >. Есть такие кварталы в больших городах, ","не работа, а игра",работа,игра,neut,no,no
vadimportretist.ru,"проходил через одеяло так, как будто это < был не ребенок, а грелка > с горячей водой. Она быстро огляделась, ","не ребенок, а грелка с горячей водой",ребенок,грелка с горячей водой,neut,yes,no
vadimportretist.ru,"проходил через одеяло так, как будто это < был не ребенок, а грелка > с горячей водой. Там, на окаймленном пальмами ","не ребенок, а грелка с горячей водой",ребенок,грелка с горячей водой,neut,yes,no
eastlib.ru,"воде, он, казалось, преобразился: это уже < был не человек, а бревно >. Первым двум удалось ухватиться за него ","не человек, а бревно",человек,бревно,neut,yes,no
thelib.ru,"стал в десять раз больше прежнего. Это уже < был не человек, а великан >, и не лошадь, а животное с контурами лошади ","не человек, а великан",человек,великан,neut,yes,no
curwood.ru,"волкам. Покричал — и стал прислушиваться. Это < был не человек, а гигант >. «Чудовище», — подумал Филипп. Возможно ","не человек, а гигант",человек,гигант,neut,yes,no
azlib.ru,"он и кучером был у барина. Казалось, это < был не человек, а машина >, стенобитное орудие, одинаково молчаливое ","не человек, а машина",человек,машина,neut,yes,no
mazip.ru,"на минуту она не оставляла работы, точно < была не человек, а механизм >. Ефрем Васильич, человек очень малого ","не человек, а механизм",человек,механизм,neut,yes,no
lib.ru,"поэтому получил прозвище ""Джон-Бочка"". Это < был не человек, а слон > в образе человеческом. Ростом шесть футов ","не человек, а слон в образе человеческом",человек,слон в образе человеческом,neut,yes,no
okopka.ru,"- предводитель обошел Сергея, словно тот < был не человек, а столб >, и, наклонившись, вгляделся в перемазанное ","не человек, а столб",человек,столб,neut,yes,no
oldsf.ufacom.ru,"Собеседник был точной копией Рата, но он < был не человек, а машина >, и на него нельзя было сердиться... Теперь ","не человек, а машина",человек,машина,neut,yes,no
maykapar.ru,"оплакивалась утрата, заканчивалась словами: ""То < был не человек, а пес >"". Гайдн тайком переписал эпитафию и сочинил ","не человек, а пес",человек,пес,neg,yes,no
tehexe.ru,"наверное мало кто умирал. женщина так вообще < была не человек, а ребенок > и подавно. Уроды конечно были и есть, но ","не человек, а ребенок",человек,ребенок,neg,yes,no
mir-slovo.ru,"лежали длинные серостальные пряди волос. Это < был не человек, а силуэт > — до того он был жутко не похож на окружающих ","не человек, а силуэт",человек,силуэт,neut,yes,no